{"ingestion_id":"ING-06","day_key":"02-29","temporal_position":{"numeric_value":1900,"era":"CE","precision":"EXACT","calendar_type":"Julian","is_leap_slot_mapping":false,"actual_calendar_date":"1900-02-29"},"temporal_class":"PAST","event_status":"ARCHIVED","title":"Julian leap","summary":"Julian leap day","country":"Global","domain":"Calendar","scale":"Global","source_origin":"Calendar","evidence":[],"evidence_status":"Pending Evidence","discovered_at":"2026-08-23","integrated_at":"2026-08-23"}