{"ingestion_id":"ING-02","day_key":"08-23","temporal_position":{"numeric_value":2026,"era":"CE","precision":"EXACT","calendar_type":"Gregorian","is_leap_slot_mapping":false,"actual_calendar_date":"2026-08-23"},"temporal_class":"PRESENT","event_status":"OBSERVING","title":"Present","summary":"Present record","country":"VN","domain":"System","scale":"National","source_origin":"Observation","evidence":[],"evidence_status":"Pending Evidence","discovered_at":"2026-08-23","integrated_at":"2026-08-23"}