{"ingestion_id":"ING-09","day_key":"01-01","temporal_position":{"numeric_value":2026,"era":"CE","precision":"EXACT","calendar_type":"Gregorian","is_leap_slot_mapping":false,"actual_calendar_date":"2026-01-01"},"temporal_class":"PAST","event_status":"ARCHIVED","title":"Global","summary":"Global scope record","country":"Global","domain":"Global","scale":"Global","source_origin":"Global Feed","evidence":[],"evidence_status":"Pending Evidence","discovered_at":"2026-08-23","integrated_at":"2026-08-23","geographic_scope":{"region":"Worldwide","is_global":true,"coordinates":null}}