{"ingestion_id":"ING-01","day_key":"08-23","temporal_position":{"numeric_value":2024,"era":"CE","precision":"EXACT","calendar_type":"Gregorian","is_leap_slot_mapping":false,"actual_calendar_date":"2024-08-23"},"temporal_class":"PAST","event_status":"ARCHIVED","title":"Past","summary":"Past record","country":"VN","domain":"History","scale":"National","source_origin":"Archive","evidence":[],"evidence_status":"Pending Evidence","discovered_at":"2026-08-23","integrated_at":"2026-08-23"}