{"ingestion_id":"ING-08","day_key":"06-01","temporal_position":{"numeric_value":1200,"era":"CE","precision":"APPROXIMATE","calendar_type":"Approximate","is_leap_slot_mapping":false,"actual_calendar_date":null,"original_expression":"Approx 1200"},"temporal_class":"PAST","event_status":"ARCHIVED","title":"Approximate","summary":"Approximate historical date","country":"Global","domain":"History","scale":"Global","source_origin":"Archive","evidence":[],"evidence_status":"Pending Evidence","discovered_at":"2026-08-23","integrated_at":"2026-08-23"}