{"ingestion_id":"ING-10","day_key":"09-20","temporal_position":{"numeric_value":2026,"era":"CE","precision":"EXACT","calendar_type":"Gregorian","is_leap_slot_mapping":false,"actual_calendar_date":"2026-09-20"},"temporal_class":"FUTURE","event_status":"DELAYED","title":"Delayed","summary":"Delayed future event","country":"VN","domain":"Ops","scale":"Local","source_origin":"Notice","evidence":[],"evidence_status":"Pending Evidence","discovered_at":"2026-08-23","integrated_at":"2026-08-23","future_metadata":{"original_target_datetime":"2026-09-10T10:00:00+07:00","current_target_datetime":"2026-09-20T10:00:00+07:00","countdown_enabled":true,"countdown_status":"RUNNING","future_confidence":"SCHEDULED","future_source":"Notice","reached_target_at":null,"actual_outcome_status":"DELAYED","actual_outcome_evidence":[{"evidence_id":"EV-README","source_url":"https://raw.githubusercontent.com/charityfundplus/CFP.plus/99aab62ef356d015a682ae85328b3e80a9df2ffe/README.md","content_hash":"0cca6b93c8b705abfeb2b58f2669bb10f244ab80e4b63a53561b0ffd14d5a254","evidence_type":"Official Document","description":"Pinned artifact","verified_at":"2026-08-23","verification_actor":"CFP+ CTTTC CI"}],"schedule_history":[{"changed_at":"2026-08-23T21:00:00+07:00","previous_target":"2026-09-10T10:00:00+07:00","new_target":"2026-09-20T10:00:00+07:00","reason":"Schedule change"}]}}