{"ingestion_id":"ING-05","day_key":"02-29","temporal_position":{"numeric_value":2023,"era":"CE","precision":"EXACT","calendar_type":"Gregorian","is_leap_slot_mapping":true,"actual_calendar_date":null},"temporal_class":"PAST","event_status":"ARCHIVED","title":"Structural 02-29","summary":"Permanent structural slot","country":"Global","domain":"Calendar","scale":"Global","source_origin":"CTTTC","evidence":[],"evidence_status":"Pending Evidence","discovered_at":"2026-08-23","integrated_at":"2026-08-23"}