{"ingestion_id":"ING-07","day_key":"03-15","temporal_position":{"numeric_value":44,"era":"BCE","precision":"EXACT","calendar_type":"Julian","is_leap_slot_mapping":false,"actual_calendar_date":null,"original_expression":"44 BCE"},"temporal_class":"PAST","event_status":"ARCHIVED","title":"BCE","summary":"Historical BCE record","country":"IT","domain":"History","scale":"Global","source_origin":"Archive","evidence":[],"evidence_status":"Pending Evidence","discovered_at":"2026-08-23","integrated_at":"2026-08-23"}