{"ingestion_id":"ING-04","day_key":"02-29","temporal_position":{"numeric_value":2024,"era":"CE","precision":"EXACT","calendar_type":"Gregorian","is_leap_slot_mapping":false,"actual_calendar_date":"2024-02-29"},"temporal_class":"PAST","event_status":"ARCHIVED","title":"Gregorian leap","summary":"Leap day","country":"Global","domain":"Calendar","scale":"Global","source_origin":"Calendar","evidence":[],"evidence_status":"Pending Evidence","discovered_at":"2026-08-23","integrated_at":"2026-08-23"}