{"ingestion_id":"ING-03","day_key":"12-31","temporal_position":{"numeric_value":2030,"era":"CE","precision":"EXACT","calendar_type":"Gregorian","is_leap_slot_mapping":false,"actual_calendar_date":"2030-12-31"},"temporal_class":"FUTURE","event_status":"RUNNING","title":"Future","summary":"Future record","country":"Global","domain":"Roadmap","scale":"Global","source_origin":"Plan","evidence":[],"evidence_status":"Pending Evidence","discovered_at":"2026-08-23","integrated_at":"2026-08-23","future_metadata":{"original_target_datetime":"2030-12-31T00:00:00+07:00","current_target_datetime":"2030-12-31T00:00:00+07:00","countdown_enabled":true,"countdown_status":"RUNNING","future_confidence":"SCHEDULED","future_source":"Plan","reached_target_at":null,"actual_outcome_status":null,"actual_outcome_evidence":[],"schedule_history":[]}}